{
  "schema_version": "amy.pre-r0-closure-ledger.v1-draft",
  "status": "NO-GO",
  "classification": "pre_registration_planning_evidence_not_scientific_result",
  "bindings": {
    "registration_gates_sha256": "7340ff4a76363dcb4757ba954649e18567e518c3214b7a34152a81216f265dd9",
    "run_execution_policy_sha256": "e25779a38cc23b376facc849b0520b326005e53c0b3ddd67c6c8f6d3208c188a",
    "run_execution_policy_validation_sha256": "0f7543f1742fbcb147a516825e110dc79a6d42f0110bef5667b2aecac2d9e6ea",
    "selected_compatibility_matrix_sha256": "4de12c8c03c4227619986c63f3532047c3bcff3a960bb7bac40ccfebaa1031a1",
    "r0_reviewer_identity_policy_validation_sha256": "05a09a9021734fdbe26367cdb6821ad293f52258edfb7aba247f9b395db18a4f",
    "release_lineage_validation_sha256": "13a24e86041b1c4af61f3a998df3625bde3fd39ce08f718ae679177f607dc357"
  },
  "summary": {
    "registration_blocker_count": 10,
    "partial_blocker_count": 7,
    "open_blocker_count": 3,
    "pending_compatibility_row_count": 54,
    "unresolved_tbd_count": 47,
    "runner_open_control_count": 11,
    "confirmatory_execution_permitted": false,
    "freeze_permitted": false
  },
  "controls": [
    {
      "gate_id": "RG-001",
      "gate_status": "partial",
      "closure_domain": "mixed",
      "blocks_registration": true,
      "blocks_confirmatory_execution": true,
      "current_evidence_paths": ["protocol/PROPOSITION_MATRIX_DRAFT.json", "scripts/validate_protocol.py"],
      "established_claims": ["A closed draft maps 12 propositions to units, outcomes, falsification rules, and claim eligibility."],
      "prohibited_inferences": ["Schema validity and same-worktree checks do not establish that the proposition set is unbiased, complete, or externally reviewed."],
      "unmet_requirements": [
        {
          "id": "CLOSE-RG001-HUMAN-REVIEW",
          "evidence_kind": "human_review",
          "status": "OPEN",
          "can_complete_in_current_worktree": false,
          "requires_external_actor": true,
          "required_artifacts": ["signed exact-byte proposition review", "reviewer qualification and conflict declarations"],
          "acceptance_test": "A preauthorized qualified non-implementer reviews the exact proposition bytes, records every required decision, and authenticates the final record under the frozen reviewer policy."
        },
        {
          "id": "CLOSE-RG001-FREEZE",
          "evidence_kind": "frozen_exact_bytes",
          "status": "OPEN",
          "can_complete_in_current_worktree": true,
          "requires_external_actor": false,
          "required_artifacts": ["R0 manifest binding reviewed proposition bytes", "public registration identifier"],
          "acceptance_test": "The reviewed proposition matrix hash is present in the immutable R0 manifest and the registered preregistration; any later byte change creates a new lineage."
        }
      ],
      "next_action": "Keep the current matrix draft-only, place its exact bytes in the next R0 candidate packet, and solicit the qualified review before freezing."
    },
    {
      "gate_id": "RG-002",
      "gate_status": "partial",
      "closure_domain": "mixed",
      "blocks_registration": true,
      "blocks_confirmatory_execution": true,
      "current_evidence_paths": ["corpus/BASE_REGISTRY_DRAFT.json", "corpus/COMPATIBILITY_MATRIX_SELECTED_PROFILE_DRAFT.json", "development_checks/BASE_AWARE_MUTATION_PLANS_2026-07-13.json", "development_checks/BASE_AWARE_MUTATION_PLANS_2026-07-15.json", "development_checks/BASE_AWARE_MUTATION_PLANS_VALIDATION_2026-07-15.json", "development_checks/BASE_AWARE_MUTATION_PLANS_V2_2026-07-15T034921Z.json", "development_checks/BASE_AWARE_MUTATION_PLANS_VALIDATION_V2_2026-07-15T034921Z.json"],
      "established_claims": ["Six draft bases, 246 candidate units, 185 compatible rows, 54 pending rows, and 245 resolved base-aware plans plus one explicit unavailable plan are retained."],
      "prohibited_inferences": ["Development execution of disposable mutations does not freeze a confirmatory corpus or establish S2 production applicability."],
      "unmet_requirements": [
        {
          "id": "CLOSE-RG002-COMPATIBILITY",
          "evidence_kind": "compatibility_resolution",
          "status": "OPEN",
          "can_complete_in_current_worktree": true,
          "requires_external_actor": false,
          "required_artifacts": ["zero-pending selected compatibility matrix", "documented resolution for every unavailable unit"],
          "acceptance_test": "The outcome-blind matrix validator reports zero PENDING rows, every row has a frozen reason and plan, and no observed verifier outcome participated in compatibility classification."
        },
        {
          "id": "CLOSE-RG002-CROSS-PLATFORM",
          "evidence_kind": "external_execution",
          "status": "OPEN",
          "can_complete_in_current_worktree": false,
          "requires_external_actor": true,
          "required_artifacts": ["hash-bound selected-base replay from pinned Linux", "comparison against author-environment replay"],
          "acceptance_test": "A separately operated pinned Linux environment reproduces the frozen clean-base artifacts and records byte comparisons without access to confirmatory outcomes."
        }
      ],
      "next_action": "Resolve the 54 policy-dependent rows without outcome data, instantiate the S2 A.M.Y base, then repeat clean-base construction in the pinned environment."
    },
    {
      "gate_id": "RG-004",
      "gate_status": "open",
      "closure_domain": "external_human",
      "blocks_registration": true,
      "blocks_confirmatory_execution": true,
      "current_evidence_paths": ["reviews/R0_REVIEW_PACKET_DRAFT.md", "paper/MANUSCRIPT_SKELETON.md", "paper/lint_manuscript.py", "protocol/R0_HUMAN_REVIEW_RECORD_TEMPLATE.json", "protocol/R0_REVIEWER_IDENTITY_POLICY_VALIDATION.json", "schemas/r0-human-review-record.schema.json", "tests/test_manuscript_skeleton.py"],
      "established_claims": ["Deterministic packet construction, a protocol-aligned manuscript skeleton with 11 stage-discipline tests, a closed review-record schema requiring one manuscript-consistency decision, and a fail-closed reviewer-identity policy validator exist as preparation mechanics."],
      "prohibited_inferences": ["No person is currently authorized or qualified by these empty templates, and no human review or signature has occurred."],
      "unmet_requirements": [
        {
          "id": "CLOSE-RG004-IDENTITY",
          "evidence_kind": "policy_instantiation",
          "status": "OPEN",
          "can_complete_in_current_worktree": false,
          "requires_external_actor": true,
          "required_artifacts": ["exact reviewer identity", "exact issuer", "authorization record", "trusted root", "patched verifier identity"],
          "acceptance_test": "Every null or unresolved identity-policy field is instantiated before review, the verifier version is outside known vulnerable ranges, and policy validation returns GO without bypasses."
        },
        {
          "id": "CLOSE-RG004-REVIEW",
          "evidence_kind": "human_review",
          "status": "OPEN",
          "can_complete_in_current_worktree": false,
          "requires_external_actor": true,
          "required_artifacts": ["completed exact-byte review record", "detached authenticated signature or Sigstore bundle", "qualification and conflict evidence"],
          "acceptance_test": "A qualified non-author and non-implementer who did not author the manuscript skeleton and has no outcome or subject-write access completes every required catalog, oracle, proposition, compatibility, policy, and manuscript-consistency decision and authenticates the record over the exact packet hash."
        }
      ],
      "next_action": "Select and externally authorize a qualified reviewer, instantiate the identity policy, rebuild a fresh packet candidate, and keep all review templates unapproved until the external record verifies."
    },
    {
      "gate_id": "RG-005",
      "gate_status": "partial",
      "closure_domain": "mixed",
      "blocks_registration": true,
      "blocks_confirmatory_execution": true,
      "current_evidence_paths": ["schemas/observation-ledger.schema.json", "schemas/analysis-summary.schema.json", "scripts/build_dummy_analysis_fixture.py", "scripts/analyze_observation_ledger.py", "dummy_analysis/DUMMY_OBSERVATION_LEDGER.json", "dummy_analysis/DUMMY_ANALYSIS_SUMMARY.json", "evidence/CLAIM_EVIDENCE_MATRIX.csv", "scripts/validate_claim_evidence_matrix.py", "tests/test_dummy_analysis.py", "tests/test_claim_evidence_matrix.py"],
      "established_claims": ["A 1,480-row dummy ledger is joined back to the exact catalog, matrix, and oracle; composite cells and profile-paired case bytes are enforced; a profile-by-family breakdown reconciles; 70 claim-evidence references resolve by exact path, locator, and SHA-256; and neither validator can authorize manuscript claims."],
      "prohibited_inferences": ["Synthetic outcomes cannot estimate conformance, reliability, effect size, or empirical support for any paper claim."],
      "unmet_requirements": [
        {
          "id": "CLOSE-RG005-FINAL-DENOMINATOR",
          "evidence_kind": "compatibility_resolution",
          "status": "OPEN",
          "can_complete_in_current_worktree": true,
          "requires_external_actor": false,
          "required_artifacts": ["zero-pending compatibility matrix", "regenerated exact planned denominator", "reviewed analysis contract"],
          "acceptance_test": "The denominator is regenerated only after all compatibility rows are frozen, all planned keys are represented exactly once, and qualified review accepts missingness and claim-decision rules."
        }
      ],
      "next_action": "Do not change the analyzer from synthetic validation to confirmatory use until the final compatibility product, campaign-selection linkage, and external review are available."
    },